{
  "id": "pver-contract-ordinary-v1",
  "paper_id": "paper-contract-ordinary",
  "version_label": "v1",
  "source": "arxiv",
  "source_version_id": "2507.12345v1",
  "publication_date": "2026-07-30",
  "pdf_url": "https://example.test/papers/ordinary.pdf",
  "pdf_checksum": "sha256:ordinarypdf",
  "metadata": {
    "source": "contract-fixture"
  },
  "created_at": "2026-08-02T00:00:00+00:00",
  "updated_at": "2026-08-02T00:00:00+00:00"
}
